[{"id":"Contract_Item_1","sourceId":"Contract_Item_1","name":"Test Plank","description":"A made-up item for tests.","rarity":"Common","tier":1,"stack":20,"sourceCategory":"resource","sourceCategoryLabel":"Resource","topLevelCategoryId":"resource","topLevelCategoryLabel":"Resource","categoryId":"resource","itemTag":"Item.resource","itemTypeTag":"ItemType.resource","tooltip":{"category":"Resource","description":null,"mainStat":{"stat":"ShipFireRangeRANK","curveTable":"None","rowName":"B","curveLevel":null,"grade":"B","valueLevel1":"B"},"secondaryStats":[],"additionalStats":[],"descriptionData":[{"curveTable":"CT_Contract","rowName":"Cutlass_Contract_AbilityCooldown","curveLevel":1,"displayType":"SecondsAsMinutes","inverse":false,"valueLevel1":2,"rawValue":120}],"effectsDescriptions":[],"setEffectsDescriptions":[],"vanityText":null},"drops":[]},{"id":"Contract_Item_2","sourceId":"Contract_Item_2","name":"Test Ration","description":"A made-up item for tests.","rarity":"Common","tier":1,"stack":20,"sourceCategory":"food","sourceCategoryLabel":"Food","topLevelCategoryId":"food","topLevelCategoryLabel":"Food","categoryId":"food","itemTag":"Item.food","itemTypeTag":"ItemType.food","tooltip":{"category":"Food","description":null,"mainStat":null,"secondaryStats":[{"stat":"AttackPower","label":"Attack power","curveTable":"CT_Contract","rowName":"Contract_Attack","curveLevel":1,"valueLevel1":12}],"additionalStats":[],"descriptionData":[{"label":"Critical chance","curveTable":"CT_Contract","rowName":"Contract_SetEffect_CritChance","curveLevel":1,"displayType":"RatioToPercent","inverse":false,"valueLevel1":15,"rawValue":0.15}],"effectsDescriptions":[],"setEffectsDescriptions":[],"vanityText":null},"drops":[]}]